{
  "approvalIdHash": "aaaaaaaaaaaaaaaaaaaaaaaaaaaaaaaaaaaaaaaaaaaaaaaaaaaaaaaaaaaaaaaa",
  "approvalStatus": "APPROVED",
  "artifactCap": 0,
  "ciDigest": "bbbbbbbbbbbbbbbbbbbbbbbbbbbbbbbbbbbbbbbbbbbbbbbbbbbbbbbbbbbbbbbb",
  "contractId": "foreign-news-provider-probe-approval-v1",
  "costCapMicrousd": 10000,
  "date": "2026-08-03",
  "decisionAuthority": "NONE",
  "endpointSetDigest": "cccccccccccccccccccccccccccccccccccccccccccccccccccccccccccccccc",
  "executionAllowed": true,
  "expiresAt": "2030-01-02T03:19:00Z",
  "headSha": "dddddddddddddddddddddddddddddddddddddddd",
  "logicalCallCap": 1,
  "nonceHash": "eeeeeeeeeeeeeeeeeeeeeeeeeeeeeeeeeeeeeeeeeeeeeeeeeeeeeeeeeeeeeeee",
  "operation": "FINNHUB_COMPANY_NEWS",
  "operatorHash": "ffffffffffffffffffffffffffffffffffffffffffffffffffffffffffffffff",
  "physicalCallCap": 1,
  "providerFamily": "FINNHUB_PERSONAL_LOCAL",
  "rawHeaderStored": false,
  "rawProviderDataStored": false,
  "rawQueryStored": false,
  "requestPlanDigest": "1111111111111111111111111111111111111111111111111111111111111111",
  "retryCount": 0,
  "riskSignalOrderAuthority": "NONE",
  "schemaVersion": 1,
  "securityDigest": "2222222222222222222222222222222222222222222222222222222222222222",
  "symbol": "005930.KS",
  "trackedRawArtifactCount": 0,
  "treeSha256": "3333333333333333333333333333333333333333333333333333333333333333"
}
